{
  "version": 1,
  "sessionID": "11111111-1111-4111-8111-111111111111",
  "state": "running",
  "frame": {
    "version": 1,
    "sessionID": "11111111-1111-4111-8111-111111111111",
    "sequence": 3,
    "receivedAt": 100.05,
    "audio": {
      "time": 0.064,
      "sampleRate": 48000,
      "channelCount": 2,
      "rms": 0.1,
      "rmsDBFS": -20,
      "peak": 0.2,
      "crestDB": 6.020599913,
      "envelope": 0.08,
      "isSilent": false,
      "silenceDuration": 0,
      "lowEnergy": 0.005,
      "midEnergy": 0.003,
      "highEnergy": 0.002,
      "lowShare": 0.5,
      "midShare": 0.3,
      "highShare": 0.2,
      "centroidHz": 2000,
      "bandwidthHz": 1500,
      "flatness": 0.1,
      "spectralFlux": 0.02,
      "onsetThreshold": 0.18,
      "isOnset": false,
      "balance": 0,
      "sideEnergyRatio": 0.1,
      "correlation": 0.8,
      "displayBands": [
        0.2,
        0.2,
        0.2,
        0.2,
        0.2,
        0.2,
        0.2,
        0.2,
        0.2,
        0.2,
        0.2,
        0.2,
        0.2,
        0.2,
        0.2,
        0.2,
        0.2,
        0.2,
        0.2,
        0.2,
        0.2,
        0.2,
        0.2,
        0.2
      ]
    },
    "melody": {
      "time": 0.042666667,
      "pitchHz": 261.6255653,
      "confidence": 0.9,
      "isMelodic": true
    }
  },
  "frameAge": 0.01,
  "onsets": [],
  "spectralFluxPeak": 0.02
}
